Rule ID,Impact,Description,Help URL,Elements
"aria-allowed-role","minor","Ensures role attribute has an appropriate value for the element","https://dequeuniversity.com/rules/axe/3.1/aria-allowed-role?application=axeAPI","{'all':[],'failureSummary':'Fix any of the following:\n  role presentation  is not allowed for given element','impact':'minor','html':'<button type=\'button\' role=\'presentation\' class=\'owl-prev\'><span aria-label=\'Previous\'>\u2039<\/span><\/button>','none':[],'any':[{'data':['presentation'],'impact':'minor','relatedNodes':[],'id':'aria-allowed-role','message':'role presentation  is not allowed for given element'}],'target':['.team-carousel2 > .owl-nav.disabled > .owl-prev[role=\'presentation\'][type=\'button\']']} | {'all':[],'failureSummary':'Fix any of the following:\n  role presentation  is not allowed for given element','impact':'minor','html':'<button type=\'button\' role=\'presentation\' class=\'owl-next\'><span aria-label=\'Next\'>\u203a<\/span><\/button>','none':[],'any':[{'data':['presentation'],'impact':'minor','relatedNodes':[],'id':'aria-allowed-role','message':'role presentation  is not allowed for given element'}],'target':['.team-carousel2 > .owl-nav.disabled > .owl-next[role=\'presentation\'][type=\'button\']']} | {'all':[],'failureSummary':'Fix any of the following:\n  role presentation  is not allowed for given element','impact':'minor','html':'<button type=\'button\' role=\'presentation\' class=\'owl-prev\'><span aria-label=\'Previous\'>\u2039<\/span><\/button>','none':[],'any':[{'data':['presentation'],'impact':'minor','relatedNodes':[],'id':'aria-allowed-role','message':'role presentation  is not allowed for given element'}],'target':['.testimonials-slider-3 > .owl-nav.disabled > .owl-prev[role=\'presentation\'][type=\'button\']']} | {'all':[],'failureSummary':'Fix any of the following:\n  role presentation  is not allowed for given element','impact':'minor','html':'<button type=\'button\' role=\'presentation\' class=\'owl-next\'><span aria-label=\'Next\'>\u203a<\/span><\/button>','none':[],'any':[{'data':['presentation'],'impact':'minor','relatedNodes':[],'id':'aria-allowed-role','message':'role presentation  is not allowed for given element'}],'target':['.testimonials-slider-3 > .owl-nav.disabled > .owl-next[role=\'presentation\'][type=\'button\']']}"
"button-name","critical","Ensures buttons have discernible text","https://dequeuniversity.com/rules/axe/3.1/button-name?application=axeAPI","{'all':[],'failureSummary':'Fix all of the following:\n  Element is in tab order and does not have accessible text\n\nFix any of the following:\n  Element has a value attribute and the value attribute is empty\n  Element has no value attribute or the value attribute is empty\n  Element does not have inner text that is visible to screen readers\n  aria-label attribute does not exist or is empty\n  aria-labelledby attribute does not exist, references elements that do not exist or references elements that are empty\n  Element's default semantics were not overridden with role=\'presentation\'\n  Element's default semantics were not overridden with role=\'none\'\n  Element has no title attribute or the title attribute is empty','impact':'critical','html':'<button class=\'carousel-arrow left\' onclick=\'changeSlide(-1)\'>\n                  <span class=\'pb-1\'><img src=\'images/left arrow.svg\'><\/span>\n               <\/button>','none':[{'impact':'serious','relatedNodes':[],'id':'focusable-no-name','message':'Element is in tab order and does not have accessible text'}],'any':[{'impact':'critical','relatedNodes':[],'id':'non-empty-if-present','message':'Element has a value attribute and the value attribute is empty'},{'impact':'critical','relatedNodes':[],'id':'non-empty-value','message':'Element has no value attribute or the value attribute is empty'},{'data':'','impact':'critical','relatedNodes':[],'id':'button-has-visible-text','message':'Element does not have inner text that is visible to screen readers'},{'impact':'serious','relatedNodes':[],'id':'aria-label','message':'aria-label attribute does not exist or is empty'},{'impact':'serious','relatedNodes':[],'id':'aria-labelledby','message':'aria-labelledby attribute does not exist, references elements that do not exist or references elements that are empty'},{'impact':'minor','relatedNodes':[],'id':'role-presentation','message':'Element's default semantics were not overridden with role=\'presentation\''},{'impact':'minor','relatedNodes':[],'id':'role-none','message':'Element's default semantics were not overridden with role=\'none\''},{'impact':'serious','relatedNodes':[],'id':'non-empty-title','message':'Element has no title attribute or the title attribute is empty'}],'target':['button[onclick=\'changeSlide\\(-1\\)\']']} | {'all':[],'failureSummary':'Fix all of the following:\n  Element is in tab order and does not have accessible text\n\nFix any of the following:\n  Element has a value attribute and the value attribute is empty\n  Element has no value attribute or the value attribute is empty\n  Element does not have inner text that is visible to screen readers\n  aria-label attribute does not exist or is empty\n  aria-labelledby attribute does not exist, references elements that do not exist or references elements that are empty\n  Element's default semantics were not overridden with role=\'presentation\'\n  Element's default semantics were not overridden with role=\'none\'\n  Element has no title attribute or the title attribute is empty','impact':'critical','html':'<button class=\'carousel-arrow right\' onclick=\'changeSlide(1)\'>\n                  <span class=\'pb-1\'><img src=\'images/right arrow.svg\'><\/span>\n               <\/button>','none':[{'impact':'serious','relatedNodes':[],'id':'focusable-no-name','message':'Element is in tab order and does not have accessible text'}],'any':[{'impact':'critical','relatedNodes':[],'id':'non-empty-if-present','message':'Element has a value attribute and the value attribute is empty'},{'impact':'critical','relatedNodes':[],'id':'non-empty-value','message':'Element has no value attribute or the value attribute is empty'},{'data':'','impact':'critical','relatedNodes':[],'id':'button-has-visible-text','message':'Element does not have inner text that is visible to screen readers'},{'impact':'serious','relatedNodes':[],'id':'aria-label','message':'aria-label attribute does not exist or is empty'},{'impact':'serious','relatedNodes':[],'id':'aria-labelledby','message':'aria-labelledby attribute does not exist, references elements that do not exist or references elements that are empty'},{'impact':'minor','relatedNodes':[],'id':'role-presentation','message':'Element's default semantics were not overridden with role=\'presentation\''},{'impact':'minor','relatedNodes':[],'id':'role-none','message':'Element's default semantics were not overridden with role=\'none\''},{'impact':'serious','relatedNodes':[],'id':'non-empty-title','message':'Element has no title attribute or the title attribute is empty'}],'target':['button[onclick=\'changeSlide\\(1\\)\']']}"
"color-contrast","serious","Ensures the contrast between foreground and background colors meets WCAG 2 AA contrast ratio thresholds","https://dequeuniversity.com/rules/axe/3.1/color-contrast?application=axeAPI","{'all':[],'failureSummary':'Fix any of the following:\n  Element has insufficient color contrast of 4.25 (foreground color: #f3170f, background color: #ffffff, font size: 13.5pt, font weight: bold). Expected contrast ratio of 4.5:1','impact':'serious','html':'<strong style=\'color: rgb(243, 23, 15);\'><a href=\'https://irctc.com/IRCTC/verifyIdCard\' style=\'color: blue; text-decoration: underline;\'>Click here.<\/a> Please scan the QR code of vendor ID card and verify their credentials. \'YOUR SAFETY, OUR PRIORITY. SAY NO TO UNAUTHORIZED VENDORS.\'<\/strong>','none':[],'any':[{'data':{'contrastRatio':4.25,'fgColor':'#f3170f','bgColor':'#ffffff','expectedContrastRatio':'4.5:1','fontSize':'13.5pt','fontWeight':'bold'},'impact':'serious','relatedNodes':[{'html':'<body class=\'appear-animate js-focus-visible loaded\' data-aos-easing=\'ease-in-out\' data-aos-duration=\'1000\' data-aos-delay=\'0\'>','target':['body']}],'id':'color-contrast','message':'Element has insufficient color contrast of 4.25 (foreground color: #f3170f, background color: #ffffff, font size: 13.5pt, font weight: bold). Expected contrast ratio of 4.5:1'}],'target':['strong']} | {'all':[],'failureSummary':'Fix any of the following:\n  Element has insufficient color contrast of 2.93 (foreground color: #f37021, background color: #ffffff, font size: 11.3pt, font weight: bold). Expected contrast ratio of 4.5:1','impact':'serious','html':'<a href=\'https://www.irctc.co.in/nget/train-search\' class=\'explore-link\' target=\'_blank\'>Explore\n                        →<\/a>','none':[],'any':[{'data':{'contrastRatio':2.93,'fgColor':'#f37021','bgColor':'#ffffff','expectedContrastRatio':'4.5:1','fontSize':'11.3pt','fontWeight':'bold'},'impact':'serious','relatedNodes':[{'html':'<div class=\'irctc-service-card\'>','target':['.irctc-service-card:nth-child(1)']}],'id':'color-contrast','message':'Element has insufficient color contrast of 2.93 (foreground color: #f37021, background color: #ffffff, font size: 11.3pt, font weight: bold). Expected contrast ratio of 4.5:1'}],'target':['.irctc-service-card:nth-child(1) > .card-details > .explore-link[target=\'_blank\']']} | {'all':[],'failureSummary':'Fix any of the following:\n  Element has insufficient color contrast of 2.93 (foreground color: #f37021, background color: #ffffff, font size: 11.3pt, font weight: bold). Expected contrast ratio of 4.5:1','impact':'serious','html':'<a href=\'https://www.bus.irctc.co.in\' class=\'explore-link\' target=\'_blank\'>Explore →<\/a>','none':[],'any':[{'data':{'contrastRatio':2.93,'fgColor':'#f37021','bgColor':'#ffffff','expectedContrastRatio':'4.5:1','fontSize':'11.3pt','fontWeight':'bold'},'impact':'serious','relatedNodes':[{'html':'<div class=\'irctc-service-card\'>','target':['.irctc-service-card:nth-child(2)']}],'id':'color-contrast','message':'Element has insufficient color contrast of 2.93 (foreground color: #f37021, background color: #ffffff, font size: 11.3pt, font weight: bold). Expected contrast ratio of 4.5:1'}],'target':['a[href$=\'www.bus.irctc.co.in\']']} | {'all':[],'failureSummary':'Fix any of the following:\n  Element has insufficient color contrast of 2.91 (foreground color: #ff0000, background color: #c3e2e4, font size: 18.8pt, font weight: bold). Expected contrast ratio of 3:1','impact':'serious','html':'<h6 class=\'title\'>Caution!<\/h6>','none':[],'any':[{'data':{'contrastRatio':2.91,'fgColor':'#ff0000','bgColor':'#c3e2e4','expectedContrastRatio':'3:1','fontSize':'18.8pt','fontWeight':'bold'},'impact':'serious','relatedNodes':[{'html':'<section class=\'caution-section\'>','target':['.caution-section']}],'id':'color-contrast','message':'Element has insufficient color contrast of 2.91 (foreground color: #ff0000, background color: #c3e2e4, font size: 18.8pt, font weight: bold). Expected contrast ratio of 3:1'}],'target':['.title']} | {'all':[],'failureSummary':'Fix any of the following:\n  Element has insufficient color contrast of 2.4 (foreground color: #ffffff, background color: #6eb2b7, font size: 9.0pt, font weight: bold). Expected contrast ratio of 4.5:1','impact':'serious','html':'<em class=\'tab-text\'>E ticketing<\/em>','none':[],'any':[{'data':{'contrastRatio':2.4,'fgColor':'#ffffff','bgColor':'#6eb2b7','expectedContrastRatio':'4.5:1','fontSize':'9.0pt','fontWeight':'bold'},'impact':'serious','relatedNodes':[{'html':'<div class=\'hl-rightPanel-tabs\'>','target':['.hl-rightPanel-tabs']}],'id':'color-contrast','message':'Element has insufficient color contrast of 2.4 (foreground color: #ffffff, background color: #6eb2b7, font size: 9.0pt, font weight: bold). Expected contrast ratio of 4.5:1'}],'target':['.hl-rightPanel-tab[data-name=\'userInfo1\'][data-type=\'bar\'] > em']} | {'all':[],'failureSummary':'Fix any of the following:\n  Element has insufficient color contrast of 2.4 (foreground color: #ffffff, background color: #6eb2b7, font size: 9.0pt, font weight: bold). Expected contrast ratio of 4.5:1','impact':'serious','html':'<em class=\'tab-text\'>Special<br> Trains<\/em>','none':[],'any':[{'data':{'contrastRatio':2.4,'fgColor':'#ffffff','bgColor':'#6eb2b7','expectedContrastRatio':'4.5:1','fontSize':'9.0pt','fontWeight':'bold'},'impact':'serious','relatedNodes':[{'html':'<div class=\'hl-rightPanel-tabs\'>','target':['.hl-rightPanel-tabs']}],'id':'color-contrast','message':'Element has insufficient color contrast of 2.4 (foreground color: #ffffff, background color: #6eb2b7, font size: 9.0pt, font weight: bold). Expected contrast ratio of 4.5:1'}],'target':['.hl-rightPanel-tab[data-name=\'userInfo2\'][data-type=\'bar\'] > em']} | {'all':[],'failureSummary':'Fix any of the following:\n  Element has insufficient color contrast of 2.4 (foreground color: #ffffff, background color: #6eb2b7, font size: 9.0pt, font weight: bold). Expected contrast ratio of 4.5:1','impact':'serious','html':'<em class=\'tab-text\'>Catering<\/em>','none':[],'any':[{'data':{'contrastRatio':2.4,'fgColor':'#ffffff','bgColor':'#6eb2b7','expectedContrastRatio':'4.5:1','fontSize':'9.0pt','fontWeight':'bold'},'impact':'serious','relatedNodes':[{'html':'<div class=\'hl-rightPanel-tabs\'>','target':['.hl-rightPanel-tabs']}],'id':'color-contrast','message':'Element has insufficient color contrast of 2.4 (foreground color: #ffffff, background color: #6eb2b7, font size: 9.0pt, font weight: bold). Expected contrast ratio of 4.5:1'}],'target':['.hl-rightPanel-tab[data-name=\'userInfo3\'][data-type=\'bar\'] > em']} | {'all':[],'failureSummary':'Fix any of the following:\n  Element has insufficient color contrast of 2.4 (foreground color: #ffffff, background color: #6eb2b7, font size: 9.0pt, font weight: bold). Expected contrast ratio of 4.5:1','impact':'serious','html':'<em class=\'tab-text\'>Tourism<\/em>','none':[],'any':[{'data':{'contrastRatio':2.4,'fgColor':'#ffffff','bgColor':'#6eb2b7','expectedContrastRatio':'4.5:1','fontSize':'9.0pt','fontWeight':'bold'},'impact':'serious','relatedNodes':[{'html':'<div class=\'hl-rightPanel-tabs\'>','target':['.hl-rightPanel-tabs']}],'id':'color-contrast','message':'Element has insufficient color contrast of 2.4 (foreground color: #ffffff, background color: #6eb2b7, font size: 9.0pt, font weight: bold). Expected contrast ratio of 4.5:1'}],'target':['.hl-rightPanel-tab[data-name=\'userInfo4\'][data-type=\'bar\'] > em']} | {'all':[],'failureSummary':'Fix any of the following:\n  Element has insufficient color contrast of 2.4 (foreground color: #ffffff, background color: #6eb2b7, font size: 9.0pt, font weight: bold). Expected contrast ratio of 4.5:1','impact':'serious','html':'<em class=\'tab-text\'>Stock<br> Market<\/em>','none':[],'any':[{'data':{'contrastRatio':2.4,'fgColor':'#ffffff','bgColor':'#6eb2b7','expectedContrastRatio':'4.5:1','fontSize':'9.0pt','fontWeight':'bold'},'impact':'serious','relatedNodes':[{'html':'<div class=\'hl-rightPanel-tabs\'>','target':['.hl-rightPanel-tabs']}],'id':'color-contrast','message':'Element has insufficient color contrast of 2.4 (foreground color: #ffffff, background color: #6eb2b7, font size: 9.0pt, font weight: bold). Expected contrast ratio of 4.5:1'}],'target':['.hl-rightPanel-tab[data-name=\'userInfo5\'][data-type=\'bar\'] > em']}"
"empty-heading","minor","Ensures headings have discernible text","https://dequeuniversity.com/rules/axe/3.1/empty-heading?application=axeAPI","{'all':[],'failureSummary':'Fix any of the following:\n  Element does not have text that is visible to screen readers','impact':'minor','html':'<h6>&nbsp;<\/h6>','none':[],'any':[{'impact':'minor','relatedNodes':[],'id':'has-visible-text','message':'Element does not have text that is visible to screen readers'}],'target':['.logo-container > h6']}"
"heading-order","moderate","Ensures the order of headings is semantically correct","https://dequeuniversity.com/rules/axe/3.1/heading-order?application=axeAPI","{'all':[],'failureSummary':'Fix any of the following:\n  Heading order invalid','impact':'moderate','html':'<h5>Train Ticket<\/h5>','none':[],'any':[{'data':5,'impact':'moderate','relatedNodes':[],'id':'heading-order','message':'Heading order invalid'}],'target':['.irctc-service-card:nth-child(1) > .card-details > h5']} | {'all':[],'failureSummary':'Fix any of the following:\n  Heading order invalid','impact':'moderate','html':'<h6>&nbsp;<\/h6>','none':[],'any':[{'data':6,'impact':'moderate','relatedNodes':[],'id':'heading-order','message':'Heading order invalid'}],'target':['.logo-container > h6']}"
"image-alt","critical","Ensures <img> elements have alternate text or a role of none or presentation","https://dequeuniversity.com/rules/axe/3.1/image-alt?application=axeAPI","{'all':[],'failureSummary':'Fix any of the following:\n  Element does not have an alt attribute\n  aria-label attribute does not exist or is empty\n  aria-labelledby attribute does not exist, references elements that do not exist or references elements that are empty\n  Element has no title attribute or the title attribute is empty\n  Element's default semantics were not overridden with role=\'presentation\'\n  Element's default semantics were not overridden with role=\'none\'','impact':'critical','html':'<img src=\'images/left arrow.svg\'>','none':[],'any':[{'impact':'critical','relatedNodes':[],'id':'has-alt','message':'Element does not have an alt attribute'},{'impact':'serious','relatedNodes':[],'id':'aria-label','message':'aria-label attribute does not exist or is empty'},{'impact':'serious','relatedNodes':[],'id':'aria-labelledby','message':'aria-labelledby attribute does not exist, references elements that do not exist or references elements that are empty'},{'impact':'serious','relatedNodes':[],'id':'non-empty-title','message':'Element has no title attribute or the title attribute is empty'},{'impact':'minor','relatedNodes':[],'id':'role-presentation','message':'Element's default semantics were not overridden with role=\'presentation\''},{'impact':'minor','relatedNodes':[],'id':'role-none','message':'Element's default semantics were not overridden with role=\'none\''}],'target':[':root']} | {'all':[],'failureSummary':'Fix any of the following:\n  Element does not have an alt attribute\n  aria-label attribute does not exist or is empty\n  aria-labelledby attribute does not exist, references elements that do not exist or references elements that are empty\n  Element has no title attribute or the title attribute is empty\n  Element's default semantics were not overridden with role=\'presentation\'\n  Element's default semantics were not overridden with role=\'none\'','impact':'critical','html':'<img src=\'images/right arrow.svg\'>','none':[],'any':[{'impact':'critical','relatedNodes':[],'id':'has-alt','message':'Element does not have an alt attribute'},{'impact':'serious','relatedNodes':[],'id':'aria-label','message':'aria-label attribute does not exist or is empty'},{'impact':'serious','relatedNodes':[],'id':'aria-labelledby','message':'aria-labelledby attribute does not exist, references elements that do not exist or references elements that are empty'},{'impact':'serious','relatedNodes':[],'id':'non-empty-title','message':'Element has no title attribute or the title attribute is empty'},{'impact':'minor','relatedNodes':[],'id':'role-presentation','message':'Element's default semantics were not overridden with role=\'presentation\''},{'impact':'minor','relatedNodes':[],'id':'role-none','message':'Element's default semantics were not overridden with role=\'none\''}],'target':[':root']} | {'all':[],'failureSummary':'Fix any of the following:\n  Element does not have an alt attribute\n  aria-label attribute does not exist or is empty\n  aria-labelledby attribute does not exist, references elements that do not exist or references elements that are empty\n  Element has no title attribute or the title attribute is empty\n  Element's default semantics were not overridden with role=\'presentation\'\n  Element's default semantics were not overridden with role=\'none\'','impact':'critical','html':'<img src=\'assets/images/hits3.png\' style=\'width:40px; height:40px;\'>','none':[],'any':[{'impact':'critical','relatedNodes':[],'id':'has-alt','message':'Element does not have an alt attribute'},{'impact':'serious','relatedNodes':[],'id':'aria-label','message':'aria-label attribute does not exist or is empty'},{'impact':'serious','relatedNodes':[],'id':'aria-labelledby','message':'aria-labelledby attribute does not exist, references elements that do not exist or references elements that are empty'},{'impact':'serious','relatedNodes':[],'id':'non-empty-title','message':'Element has no title attribute or the title attribute is empty'},{'impact':'minor','relatedNodes':[],'id':'role-presentation','message':'Element's default semantics were not overridden with role=\'presentation\''},{'impact':'minor','relatedNodes':[],'id':'role-none','message':'Element's default semantics were not overridden with role=\'none\''}],'target':['img[src$=\'hits3.png\']']}"
